name,address,postcode,has_london_office,twitter,notes,source_url
Prima Mente,Third Floor 20 Old Bailey London,EC4M 7AN,true,@PrimaMente,Epigenetics and neurodegenerative disease AI diagnostics (Alzheimer's/Parkinson's). Building biological foundation models for the brain.,https://find-and-update.company-information.service.gov.uk/company/13671760
Charm Therapeutics,The Stanley Building 7 Pancras Square London,N1C 4AG,true,@CHARMTherapeutx,AI-powered small molecule drug discovery using 3D deep learning (DragonFold technology) for protein-ligand interactions,https://find-and-update.company-information.service.gov.uk/company/13641471
Valence Discovery,3 Pancras Square King's Cross London,N1C 4AG,true,@valence_ai,AI-enabled drug design (acquired by Recursion in May 2023). Now part of Valence Labs - Recursion's AI research engine,https://www.globenewswire.com/news-release/2024/03/11/2843488/0/en/Recursion-Announces-Plans-to-Open-New-Office-in-London.html
Recursion Pharmaceuticals,3 Pancras Square King's Cross London,N1C 4AG,true,@RecursionPharma,AI-powered drug discovery platform combining biology chemistry and technology. London office opened June 2024 (6700 sq ft),https://ir.recursion.com/news-releases/news-release-details/recursion-announces-plans-open-new-office-london
Entelo Bio,Bioescalator Innovation Building Old Road Campus Roosevelt Drive Oxford,OX3 7FZ,false,@entelobio,Precision medicine for human resilience. Registered as Caeruleus Genomics Ltd. Oxford-based (not London),https://find-and-update.company-information.service.gov.uk/company/14481675
Hologen,86-87 Campden Street London,W8 7EN,true,Not verified,Frontier medical AI company focused on drug development diagnostics and investment. Spun out from UCL and King's College London. Co-founded by Eric Schmidt,https://find-and-update.company-information.service.gov.uk/company/14666561
